-- simple tests to iteratively build the zedstore
-- create and drop works
create table t_zedstore(c1 int, c2 int, c3 int) USING zedstore;
drop table t_zedstore;
-- insert and select works
create table t_zedstore(c1 int, c2 int, c3 int) USING zedstore;
insert into t_zedstore select i,i+1,i+2 from generate_series(1, 10)i;
select * from t_zedstore;
 c1 | c2 | c3 
----+----+----
  1 |  2 |  3
  2 |  3 |  4
  3 |  4 |  5
  4 |  5 |  6
  5 |  6 |  7
  6 |  7 |  8
  7 |  8 |  9
  8 |  9 | 10
  9 | 10 | 11
 10 | 11 | 12
(10 rows)

-- selecting only few columns work
select c1, c3 from t_zedstore;
 c1 | c3 
----+----
  1 |  3
  2 |  4
  3 |  5
  4 |  6
  5 |  7
  6 |  8
  7 |  9
  8 | 10
  9 | 11
 10 | 12
(10 rows)

-- only few columns in output and where clause work
select c3 from t_zedstore where c2 > 5;
 c3 
----
  7
  8
  9
 10
 11
 12
(6 rows)

-- Test abort works
begin;
insert into t_zedstore select i,i+1,i+2 from generate_series(21, 25)i;
abort;
insert into t_zedstore select i,i+1,i+2 from generate_series(31, 35)i;
select * from t_zedstore;
 c1 | c2 | c3 
----+----+----
  1 |  2 |  3
  2 |  3 |  4
  3 |  4 |  5
  4 |  5 |  6
  5 |  6 |  7
  6 |  7 |  8
  7 |  8 |  9
  8 |  9 | 10
  9 | 10 | 11
 10 | 11 | 12
 31 | 32 | 33
 32 | 33 | 34
 33 | 34 | 35
 34 | 35 | 36
 35 | 36 | 37
(15 rows)

--
-- Test indexing
--
create index on t_zedstore (c1);
set enable_seqscan=off;
set enable_indexscan=on;
set enable_bitmapscan=off;
-- index scan
select * from t_zedstore where c1 = 5;
 c1 | c2 | c3 
----+----+----
  5 |  6 |  7
(1 row)

-- index-only scan
select c1 from t_zedstore where c1 = 5;
 c1 
----
  5
(1 row)

-- bitmap scan
set enable_indexscan=off;
set enable_bitmapscan=on;
select c1, c2 from t_zedstore where c1 between 5 and 10;
 c1 | c2 
----+----
  5 |  6
  6 |  7
  7 |  8
  8 |  9
  9 | 10
 10 | 11
(6 rows)

--
-- Test DELETE and UPDATE
--
delete from t_zedstore where c2 = 5;
select * from t_zedstore;
 c1 | c2 | c3 
----+----+----
  1 |  2 |  3
  2 |  3 |  4
  3 |  4 |  5
  5 |  6 |  7
  6 |  7 |  8
  7 |  8 |  9
  8 |  9 | 10
  9 | 10 | 11
 10 | 11 | 12
 31 | 32 | 33
 32 | 33 | 34
 33 | 34 | 35
 34 | 35 | 36
 35 | 36 | 37
(14 rows)

delete from t_zedstore where c2 < 5;
select * from t_zedstore;
 c1 | c2 | c3 
----+----+----
  5 |  6 |  7
  6 |  7 |  8
  7 |  8 |  9
  8 |  9 | 10
  9 | 10 | 11
 10 | 11 | 12
 31 | 32 | 33
 32 | 33 | 34
 33 | 34 | 35
 34 | 35 | 36
 35 | 36 | 37
(11 rows)

update t_zedstore set c2 = 100 where c1 = 8;
select * from t_zedstore;
 c1 | c2  | c3 
----+-----+----
  5 |   6 |  7
  6 |   7 |  8
  7 |   8 |  9
  9 |  10 | 11
 10 |  11 | 12
 31 |  32 | 33
 32 |  33 | 34
 33 |  34 | 35
 34 |  35 | 36
 35 |  36 | 37
  8 | 100 | 10
(11 rows)

--
-- Test VACUUM
--
vacuum t_zedstore;
select * from t_zedstore;
 c1 | c2  | c3 
----+-----+----
  5 |   6 |  7
  6 |   7 |  8
  7 |   8 |  9
  9 |  10 | 11
 10 |  11 | 12
 31 |  32 | 33
 32 |  33 | 34
 33 |  34 | 35
 34 |  35 | 36
 35 |  36 | 37
  8 | 100 | 10
(11 rows)

--
-- Test toasting
--
create table t_zedtoast(c1 int, t text) USING zedstore;
insert into t_zedtoast select i, repeat('x', 10000) from generate_series(1, 10) i;
select c1, length(t) from t_zedtoast;
 c1 | length 
----+--------
  1 |  10000
  2 |  10000
  3 |  10000
  4 |  10000
  5 |  10000
  6 |  10000
  7 |  10000
  8 |  10000
  9 |  10000
 10 |  10000
(10 rows)

--
-- Test NULL values
--
create table t_zednullvalues(c1 int, c2 int) USING zedstore;
insert into t_zednullvalues values(1, NULL), (NULL, 2);
select * from t_zednullvalues;
 c1 | c2 
----+----
  1 |   
    |  2
(2 rows)

select c2 from t_zednullvalues;
 c2 
----
   
  2
(2 rows)

update t_zednullvalues set c1 = 1, c2 = NULL;
select * from t_zednullvalues;
 c1 | c2 
----+----
  1 |   
  1 |   
(2 rows)

--
-- Test COPY
--
create table t_zedcopy(a serial, b int, c text not null default 'stuff', d text,e text) USING zedstore;
COPY t_zedcopy (a, b, c, d, e) from stdin;
COPY t_zedcopy (b, d) from stdin;
COPY t_zedcopy (b, d) from stdin;
COPY t_zedcopy (a, b, c, d, e) from stdin;
select * from t_zedcopy;
   a   | b  |   c   |   d    | e  
-------+----+-------+--------+----
  9999 |    | \N    | NN     | 
 10000 | 21 | 31    | 41     | 51
     1 |  1 | stuff | test_1 | 
     2 |  2 | stuff | test_2 | 
     3 |  3 | stuff | test_3 | 
     4 |  4 | stuff | test_4 | 
     5 |  5 | stuff | test_5 | 
 10001 | 22 | 32    | 42     | 52
 10002 | 23 | 33    | 43     | 53
 10003 | 24 | 34    | 44     | 54
 10004 | 25 | 35    | 45     | 55
 10005 | 26 | 36    | 46     | 56
(12 rows)

--
-- Also test delete and update on the table that was populated with COPY.
-- This exercises splitting the array item. (A table not populated with
-- COPY only contains single items, at the moment.)
--
delete from t_zedcopy where b = 4;
select * from t_zedcopy;
   a   | b  |   c   |   d    | e  
-------+----+-------+--------+----
  9999 |    | \N    | NN     | 
 10000 | 21 | 31    | 41     | 51
     1 |  1 | stuff | test_1 | 
     2 |  2 | stuff | test_2 | 
     3 |  3 | stuff | test_3 | 
     5 |  5 | stuff | test_5 | 
 10001 | 22 | 32    | 42     | 
 10002 | 23 | 33    | 43     | 53
 10003 | 24 | 34    | 44     | 54
 10004 | 25 | 35    | 45     | 55
 10005 | 26 | 36    | 46     | 56
(11 rows)

delete from t_zedcopy where b < 3;
select * from t_zedcopy;
   a   | b  |   c   |   d    | e  
-------+----+-------+--------+----
  9999 |    | \N    | NN     | 
 10000 | 21 | 31    | 41     | 51
     3 |  3 | stuff | test_3 | 
     5 |  5 | stuff | test_5 | 
 10001 | 22 | 32    | 42     | 
 10002 | 23 | 33    | 43     | 53
 10003 | 24 | 34    | 44     | 54
 10004 | 25 | 35    | 45     | 55
 10005 | 26 | 36    | 46     | 56
(9 rows)

update t_zedcopy set b = 100 where b = 5;
select * from t_zedcopy;
   a   |  b  |   c   |   d    | e  
-------+-----+-------+--------+----
  9999 |     | \N    | NN     | 
 10000 |  21 | 31    | 41     | 51
     3 |   3 | stuff | test_3 | 
 10001 |  22 | 32    | 42     | 
 10002 |  23 | 33    | 43     | 53
 10003 |  24 | 34    | 44     | 54
 10004 |  25 | 35    | 45     | 55
 10005 |  26 | 36    | 46     | 56
     5 | 100 | stuff | test_5 | 
(9 rows)

--
-- Test zero column table
--
create table t_zwithzerocols() using zedstore;
insert into t_zwithzerocols select t.* from t_zwithzerocols t right join generate_series(1,1) on true;
select count(*) from t_zwithzerocols;
 count 
-------
     1
(1 row)

-- Test for alter table add column
create table t_zaddcol(a int) using zedstore;
insert into t_zaddcol select * from generate_series(1, 3);
-- rewrite case
alter table t_zaddcol add column b int generated always as (a + 1) stored;
select * from t_zaddcol;
 a | b 
---+---
 1 | 2
 2 | 3
 3 | 4
(3 rows)

-- fixed length default value stored in catalog
alter table t_zaddcol add column c int default 3;
select * from t_zaddcol;
 a | b | c 
---+---+---
 1 | 2 | 3
 2 | 3 | 3
 3 | 4 | 3
(3 rows)

-- variable length default value stored in catalog
alter table t_zaddcol add column d text default 'abcdefgh';
select d from t_zaddcol;
    d     
----------
 abcdefgh
 abcdefgh
 abcdefgh
(3 rows)

-- insert after add column
insert into t_zaddcol values (2);
select * from t_zaddcol;
 a | b | c |    d     
---+---+---+----------
 1 | 2 | 3 | abcdefgh
 2 | 3 | 3 | abcdefgh
 3 | 4 | 3 | abcdefgh
 2 | 3 | 3 | abcdefgh
(4 rows)

insert into t_zaddcol (a, c, d) values (3,5, 'test_insert');
select b,c,d from t_zaddcol;
 b | c |      d      
---+---+-------------
 2 | 3 | abcdefgh
 3 | 3 | abcdefgh
 4 | 3 | abcdefgh
 3 | 3 | abcdefgh
 4 | 5 | test_insert
(5 rows)

